


	

	Megszavazták: korlátlan rálátást kapnak a titkosszolgálatok az adatainkra


	

	Tíz évre titkosították a Budapest-Belgrád vasútépítkezés iratait


	

	Müller Cecília: Több egészségügyi intézményben is tumultus alakult ki


	

	Újabb súlyos hibát találtak a felújított orosz metrókocsikon


	

	Életmentõ szabálymódosításra várnak az utazási irodák


	

	Járványhírek percrõl percre




	A horgászparadicsomi tervek elúsztak, 1200 tonna ponttyal vigasztalják a pecásokat


            

                Kiderült, ki a Rogán Antal ingatlanügyeinél megjelenõ N. András
            
            
            

                Örökre megváltozhat a laptopok alsó része, ha bejön az Apple számítása
            
            


                Tamás Ervin: Miniszter, alsógatyára vetkõzve, a szuterénbe számûzve
            
            
            

                Ezért ne üljünk autóba a koronavírus-járvány után
            
            
            

                Nem tetszett a vevõknek, hogy zárva a próbafülke - így indult újra az élet a boltokban
            
            
            

                Új idõszámítás kell - magyar kutatók és mûvészek követelnek lassabb és zöldebb életet 
            
            








	Ha tudjuk, melyik a jó döntés, miért nem azt választjuk?


	

	Nagy Iván Zsolt: Maradjanak velünk!
















	

	Megszüntették a nyomozást a Mátrai Erõmû eladása ügyében


	

	Egyre több magyar vállalkozó zálogkölcsönbõl finanszírozza a járvány utáni újranyitást


	

	Elvették a közalkalmazotti státuszt a kulturális szférában


	

	Jakab Péter: A csalhatatlanság a császárok betegsége


	

	Korcsmár Zsolt bejelentette a visszavonulását


	

	Kásler Miklós szerint a kormányon nincs támadási felület


	

	Megtámadták az EasyJetet, 9 millió utas adatai szivárogtak ki




	

	Kiadtak egy frissítést a Google mobilos keresõjéhez, segít növelni az üzemidõt


	

	Komoly szexuális vádakkal néz szembe a McDonald’s










	

	Nyolc pontban írták le Karácsonyék, mit várnak a kormánytól a járvány után


	

	Támogatja a kormány, hogy új sportcsarnok épüljön Székesfehérváron


	

	Meghalt a fiú, aki egy házibuliban kizuhant egy ablakból Budapesten


	

	Négy asztaltól nem lehet csodát várni – fõvárosi teraszkörkép karantén után


	

	Teljesen lezártak egy 700 ezres kínai várost a koronavírus miatt


	

	47 országban fenyeget súlyos élelmiszerhiány a járvány miatt


	

	Független vizsgálat indul a WHO szerepének tisztázására


	

	Közel 50 ezren váltak munkanélkülivé egyetlen hónap alatt




	Nincs azzal semmi baj, hogy a gyerekek sokat néznek képernyõt


	

	Elsõ közös gyerekét várja Joaquin Phoenix és Rooney Mara


	

	Egyre több gyerek küzd mentális problémákkal Európában


	

	36 hónapot szánt rá egy dán fotós, hogy elkészítse ezt a 3 perces videót – megérte


	

	A DSLR fényképezõgépekével vetekszik a Samsung új mobilos szenzora


	

	Örökre megváltozhat a laptopok alsó része, ha bejön az Apple számítása


	

	Nem a fogyasztása, a lökettérfogata 9,1 liter az új amerikai terepjárónak


	

	Közel 50 millió forintért árulják Paul Walker BMW M3-asát


	

	Idõutazás: szuperritka BMW-t fotóztak 1936-ban Solymáron













