


	

	Müller: Három hajléktalanszállón és huszonöt idősotthonban jelent meg a koronavírus


	

	Több teszt és kötelező maszkviselés: a népegészségügyi központ ajánlásai


	

	Ennyi pénzt költött a kormány sportra a veszélyhelyzet kihirdetése óta


	

	Újabb 83 fertőzött, nyolc halálos áldozat a koronavírus-járványban


	

	Hírek a koronavírusról percről percre




	Bihari Péter: Túl Orbán Viktor vörös vonalán


            

                Komoly szabályváltozás készül a futballban
            
            
            

                150 megapixeles kamerájú telefont dobhat piacra a Xiaomi
            
            
            

                Jelentkezett 6,4 milliárd forintjáért a legnagyobb magyar lottónyeremény nyertese
            
            


                Trump tökéletes ellenpontjaként harcol a vírussal New York kormányzója
            
            
            

                Orbán: Aki elveszti a munkáját, három hónapon belül ajánlatot kap a piacról vagy az államtól - élő
            
            
            

                Avokádó és instant tészta: teljesen átalakítja az étkezést a világjárvány
            
            
	

	Ingyenes mesekönyv segít a gyerekeknek megérteni a koronavírust


	

	Lajhárbébi született a Szegedi Vadasparkban


	

	A párizsiak kitalálták, hogy kell mozizni a karantén idején




	A kormány egyre inkább bevásárolja magát kedvenc civil szervezeteibe




	"Orális álság a lvilágban" - Szkárosi Endre régi és új hangversei 




	Noam Chomsky: A járvány a neoliberalizmus bukása


	

	Nagy Iván Zsolt: Maradjanak velünk!












	

	Elindult a Zhvg – középpontban a tudatosság és a megoldáskeresés




	

	Kipróbálták gyógyult betegek vérplazmáját egy fertőzött magyaron


	

	Maruzsa: A vizsga reggelén is meggondolhatja magát az érettségiző


	

	Jelentősen eshet a sertéshús ára


	

	A II. világháború óta nem látott gazdasági visszaesésre készül Németország




	

	Felgyógyult és munkába állt Boris Johnson


	

	Bemutatták Trump űrhadseregének első támadófegyverét


	

	Őszre halasztják az iskolai HPV-oltásokat


	

	Kínában letartóztatták a Huawei öt ex-alkalmazottját, miután a cég ügyeiről beszéltek


	

	Erőre kapott a nyilvános megszégyenítés a Facebookon a koronavírus miatt


	

	Fizetésük felét is elveszíthették a koronavírusos betegeket gyógyító orvosok










	

	A posta is kéri: használjunk maszkot


	

	Így zajlik a tesztelés Kozármislenyben, ahol minden arra vágyó lakost megmérnek - videó


	

	Felforgatja a lakáspiacot a járvány


	

	Olasz miniszterelnök: nem húzhatjuk tovább, be kell indítani a gazdaságot


	

	Gondban a borászok, olcsóbb lett a minőségi magyar bor


	

	Tarantino színésze füleket vagdos otthon, a karanténban


	

	Egyre több az alvászavar a koronavírus idején, de ez sokszor legyőzhető


	

	Döntöttek az F1-es Francia Nagydíjról


	

	Szabadulnának a karanténból a Néprajzi Múzeum szakemberei


	

	Betilthatják a mobilok koronavírusra hivatkozó nyomkövetését Izraelben


	

	Bekeményít a Google, jön a személyazonosság-ellenőrzés


	

	Vigyázzon, ilyen egyszerűen érhetik el a hackerek a WhatsApp-fiókját


	

	Golyóálló és hatalmas lett ez a Range Rover


	

	Bentley Flying Spur-teszt: a korona ékköve nem lehet SUV


	

	Magyarországon a vadonatúj Audi A3 szedán

















